{
 "id": "5.4.1.3",
 "parent": "5.4.1",
 "kind": "leaf",
 "paper_leaf": "5.4.1.3",
 "label": "Case 5.4.1.3, out(z) = 1, out(D) >= 2, D xor-type, z protected",
 "source": "FGHK rev. 2 (ECCC TR15-166 rev. 2, Aug 2022) p.29",
 "pattern": {
  "nodes": {
   "z": {
    "out": 1,
    "prot": true
   },
   "D": {
    "out": [
     2,
     null
    ],
    "type": "xor"
   }
  }
 },
 "actions": [
  {
   "name": "x <- c trivialising T; z <- c trivialising E",
   "steps": [
    {
     "var": "x",
     "kind": "const",
     "value": {
      "trivialize": "T"
     }
    },
    {
     "var": "z",
     "kind": "const",
     "value": {
      "trivialize": "E"
     }
    }
   ],
   "types": [
    6
   ]
  }
 ]
}