{
 "id": "5.4.1.1.1",
 "parent": "5.4.1.1",
 "kind": "leaf",
 "paper_leaf": "5.4.1.1.1",
 "label": "Case 5.4.1.1.1, E fed via B (B fed by t), out(B) >= 2",
 "source": "FGHK rev. 2 (ECCC TR15-166 rev. 2, Aug 2022) p.28",
 "pattern": {
  "nodes": {
   "t": {
    "kind": "var"
   },
   "B": {
    "out": [
     2,
     null
    ]
   }
  },
  "edges": [
   [
    "t",
    "B"
   ],
   [
    "B",
    "E"
   ]
  ]
 },
 "actions": [
  {
   "name": "x <- t + c trivialising E",
   "steps": [
    {
     "var": "x",
     "kind": "affine",
     "value": {
      "trivialize": "E"
     },
     "src": "t"
    }
   ],
   "types": [
    3
   ]
  }
 ]
}