{
 "id": "5.4.1.1",
 "parent": "5.4.1",
 "kind": "internal",
 "label": "Case 5.4.1.1, out(z) >= 2 (then out(D) = 1)",
 "source": "FGHK rev. 2 (ECCC TR15-166 rev. 2, Aug 2022) p.28",
 "pattern": {
  "nodes": {
   "z": {
    "out": [
     2,
     null
    ]
   },
   "D": {
    "out": 1
   }
  }
 },
 "children": [
  "5.4.1.1.0",
  "5.4.1.1.1",
  "5.4.1.1.2"
 ]
}