{
 "id": "5.4.1.1.0",
 "parent": "5.4.1.1",
 "kind": "leaf",
 "paper_leaf": null,
 "label": "Case 5.4.1.1, unlabelled sub-case: E fed by another variable t directly",
 "source": "FGHK rev. 2 (ECCC TR15-166 rev. 2, Aug 2022) p.28",
 "pattern": {
  "nodes": {
   "t": {
    "kind": "var"
   }
  },
  "edges": [
   [
    "t",
    "E"
   ]
  ]
 },
 "actions": [
  {
   "name": "t <- c trivialising E",
   "steps": [
    {
     "var": "t",
     "kind": "const",
     "value": {
      "trivialize": "E"
     }
    }
   ],
   "types": [
    3
   ]
  }
 ]
}