{
 "id": "5.4.2.2",
 "parent": "5.4.2",
 "kind": "leaf",
 "paper_leaf": "5.4.2.2",
 "label": "Case 5.4.2.2, out(B) = 1",
 "source": "FGHK rev. 2 (ECCC TR15-166 rev. 2, Aug 2022) p.30",
 "pattern": {
  "nodes": {
   "B": {
    "out": 1
   }
  }
 },
 "actions": [
  {
   "name": "y <- c trivialising T; z <- c trivialising E",
   "steps": [
    {
     "var": "y",
     "kind": "const",
     "value": {
      "trivialize": "T"
     }
    },
    {
     "var": "z",
     "kind": "const",
     "value": {
      "trivialize": "E"
     }
    }
   ],
   "types": [
    1
   ]
  }
 ]
}