{
 "id": "5.4.1.4",
 "parent": "5.4.1",
 "kind": "leaf",
 "paper_leaf": "5.4.1.4",
 "label": "Case 5.4.1.4, out(z) = 1, out(D) >= 2, D xor-type, z unprotected",
 "source": "FGHK rev. 2 (ECCC TR15-166 rev. 2, Aug 2022) p.29",
 "pattern": {
  "nodes": {
   "z": {
    "out": 1,
    "prot": false
   },
   "D": {
    "out": [
     2,
     null
    ],
    "type": "xor"
   }
  }
 },
 "actions": [
  {
   "name": "z <- (x+a)(y+b)+c (quadratic, computed at T) trivialising E",
   "steps": [
    {
     "var": "z",
     "kind": "quadratic",
     "value": {
      "trivialize": "E"
     },
     "src": "T"
    }
   ],
   "types": [
    5
   ]
  }
 ]
}