{
 "id": "1a",
 "parent": "1",
 "inherit": false,
 "kind": "leaf",
 "paper_leaf": "1",
 "label": "Case 1, x protected feeds at least two gates",
 "source": "FGHK rev. 2 (ECCC TR15-166 rev. 2, Aug 2022) p.23",
 "pattern": {
  "nodes": {
   "x": {
    "kind": "var",
    "prot": true,
    "out": [
     2,
     null
    ]
   }
  }
 },
 "actions": [
  {
   "name": "x <- 0",
   "steps": [
    {
     "var": "x",
     "kind": "const",
     "value": 0
    }
   ],
   "types": [
    7
   ]
  }
 ]
}